Title|Type|Notes|Rating|hasWatched/Played|WatchListIndex
THE NEVERENDING STORY|MOVIE|A friend said this was nostalgic and weird, but good|-1|false|5
THE SOPRANOS|SHOW|heard good things, but also sounds crazy.|-1|false|4
SPIRIT|MOVIE|Nostolgic movie my girlfriend likes. Might need to give it a try|-1|false|1
RAIN MAN|MOVIE|heard so many references about this, it must be good.|-1|false|0
TERRARIA|GAME|personal favorite. I have 1000+ hours on this.|11|true|-1
MINECRAFT|GAME|build, craft, mine, SURVIVE. I probably have 500+ hours on this game|10|true|-1
BLOONS TOWER DEFENSE 6|GAME|super simple but highly addictive|8|true|-1
NEXUS|BOOK|Yuval Noah Harari book about AI and how this technological invention compares to previous ones in human history. |9|true|-1
ALL STAR|SONG|it's the song from Shrek. Of course I like it|9|true|-1